{
  "$schema": "../../schema/biome_table.schema.json",
  "schema_version": 1,
  "region_types": ["mountains", "glacier", "tundra", "swamp", "forest", "grassland", "hills", "desert", "ocean", "lake", "river"],
  "biomes": [
    { "id": 0, "name": "MOUNTAIN", "region_type": "mountains", "confidence": "documented" },
    { "id": 1, "name": "GLACIER", "region_type": "glacier", "confidence": "observed" },
    { "id": 2, "name": "TUNDRA", "region_type": "tundra", "confidence": "observed" },
    { "id": 3, "name": "SWAMP_TEMPERATE_FRESHWATER", "region_type": "swamp", "confidence": "observed" },
    { "id": 4, "name": "SWAMP_TEMPERATE_SALTWATER", "region_type": "swamp", "confidence": "observed" },
    { "id": 5, "name": "MARSH_TEMPERATE_FRESHWATER", "region_type": "swamp", "confidence": "observed" },
    { "id": 6, "name": "MARSH_TEMPERATE_SALTWATER", "region_type": "swamp", "confidence": "observed" },
    { "id": 7, "name": "SWAMP_TROPICAL_FRESHWATER", "region_type": "swamp", "confidence": "observed" },
    { "id": 8, "name": "SWAMP_TROPICAL_SALTWATER", "region_type": "swamp", "confidence": "observed" },
    { "id": 9, "name": "SWAMP_MANGROVE", "region_type": "swamp", "confidence": "observed" },
    { "id": 10, "name": "MARSH_TROPICAL_FRESHWATER", "region_type": "swamp", "confidence": "observed" },
    { "id": 11, "name": "MARSH_TROPICAL_SALTWATER", "region_type": "swamp", "confidence": "observed" },
    { "id": 12, "name": "FOREST_TAIGA", "region_type": "forest", "confidence": "observed" },
    { "id": 13, "name": "FOREST_TEMPERATE_CONIFER", "region_type": "forest", "confidence": "observed" },
    { "id": 14, "name": "FOREST_TEMPERATE_BROADLEAF", "region_type": "forest", "confidence": "observed" },
    { "id": 15, "name": "FOREST_TROPICAL_CONIFER", "region_type": "forest", "confidence": "unverified" },
    { "id": 16, "name": "FOREST_TROPICAL_DRY_BROADLEAF", "region_type": "forest", "confidence": "unverified" },
    { "id": 17, "name": "FOREST_TROPICAL_MOIST_BROADLEAF", "region_type": "forest", "confidence": "unverified" },
    { "id": 18, "name": "GRASSLAND_TEMPERATE", "region_type": "grassland", "confidence": "observed" },
    { "id": 19, "name": "SAVANNA_TEMPERATE", "region_type": "grassland", "confidence": "observed" },
    { "id": 20, "name": "SHRUBLAND_TEMPERATE", "region_type": "grassland", "confidence": "observed" },
    { "id": 21, "name": "GRASSLAND_TROPICAL", "region_type": "grassland", "confidence": "observed" },
    { "id": 22, "name": "SAVANNA_TROPICAL", "region_type": "grassland", "confidence": "observed" },
    { "id": 23, "name": "SHRUBLAND_TROPICAL", "region_type": "grassland", "confidence": "observed" },
    { "id": 24, "name": "DESERT_BADLAND", "region_type": "desert", "confidence": "observed" },
    { "id": 25, "name": "DESERT_ROCK", "region_type": "desert", "confidence": "observed" },
    { "id": 26, "name": "DESERT_SAND", "region_type": "desert", "confidence": "observed" },
    { "id": 27, "name": "OCEAN_TROPICAL", "region_type": "ocean", "confidence": "observed" },
    { "id": 28, "name": "OCEAN_TEMPERATE", "region_type": "ocean", "confidence": "observed" },
    { "id": 29, "name": "OCEAN_ARCTIC", "region_type": "ocean", "confidence": "observed" },
    { "id": 30, "name": "LAKE_TEMPERATE_FRESHWATER", "region_type": "lake", "confidence": "observed" },
    { "id": 31, "name": "LAKE_TEMPERATE_BRACKISHWATER", "region_type": "lake", "confidence": "observed" },
    { "id": 32, "name": "LAKE_TEMPERATE_SALTWATER", "region_type": "lake", "confidence": "observed" },
    { "id": 33, "name": "LAKE_TROPICAL_FRESHWATER", "region_type": "lake", "confidence": "observed" },
    { "id": 34, "name": "LAKE_TROPICAL_BRACKISHWATER", "region_type": "lake", "confidence": "observed" },
    { "id": 35, "name": "LAKE_TROPICAL_SALTWATER", "region_type": "lake", "confidence": "observed" },
    { "id": 36, "name": "RIVER_TEMPERATE_FRESHWATER", "region_type": "river", "confidence": "observed" },
    { "id": 37, "name": "RIVER_TEMPERATE_BRACKISHWATER", "region_type": "river", "confidence": "observed" },
    { "id": 38, "name": "RIVER_TEMPERATE_SALTWATER", "region_type": "river", "confidence": "observed" },
    { "id": 39, "name": "RIVER_TROPICAL_FRESHWATER", "region_type": "river", "confidence": "observed" },
    { "id": 40, "name": "RIVER_TROPICAL_BRACKISHWATER", "region_type": "river", "confidence": "observed" },
    { "id": 41, "name": "RIVER_TROPICAL_SALTWATER", "region_type": "river", "confidence": "observed" }
  ],
  "thresholds": {
    "ocean_max_elevation": 99,
    "mountain_min_elevation": 300,
    "glacier_min_drainage": 75,
    "saline_min_salinity": 66,
    "mangrove_max_drainage": 9
  },
  "temperature_bands": [
    { "name": "frozen", "range": [-1000, -5], "frozen": true, "confidence": "observed" },
    { "name": "cold", "range": [-4, 9], "frozen": false, "confidence": "observed" },
    { "name": "temperate", "range": [10, 84], "frozen": false, "confidence": "observed" },
    { "name": "tropical", "range": [85, 1000], "frozen": false, "confidence": "observed" }
  ],
  "base": [
    { "base": "desert_sand", "rainfall": [0, 9], "drainage": [0, 32], "hills": false, "wetland": false, "confidence": "observed" },
    { "base": "desert_rock", "rainfall": [0, 9], "drainage": [33, 65], "hills": false, "wetland": false, "confidence": "observed" },
    { "base": "badlands", "rainfall": [0, 9], "drainage": [66, 100], "hills": false, "wetland": false, "confidence": "observed" },
    { "base": "grassland", "rainfall": [10, 32], "drainage": [0, 32], "hills": false, "wetland": false, "confidence": "unverified" },
    { "base": "marsh", "rainfall": [33, 65], "drainage": [0, 32], "hills": false, "wetland": true, "confidence": "observed" },
    { "base": "swamp", "rainfall": [66, 100], "drainage": [0, 32], "hills": false, "wetland": true, "confidence": "observed" },
    { "base": "grassland", "rainfall": [10, 19], "drainage": [33, 65], "hills": false, "wetland": false, "confidence": "unverified" },
    { "base": "savanna", "rainfall": [20, 32], "drainage": [33, 65], "hills": false, "wetland": false, "confidence": "unverified" },
    { "base": "shrubland", "rainfall": [33, 65], "drainage": [33, 65], "hills": false, "wetland": false, "confidence": "unverified" },
    { "base": "grassland", "rainfall": [10, 19], "drainage": [66, 100], "hills": true, "wetland": false, "confidence": "unverified" },
    { "base": "savanna", "rainfall": [20, 32], "drainage": [66, 100], "hills": true, "wetland": false, "confidence": "unverified" },
    { "base": "shrubland", "rainfall": [33, 65], "drainage": [66, 100], "hills": true, "wetland": false, "confidence": "unverified" },
    { "base": "forest_conifer", "rainfall": [66, 75], "drainage": [33, 100], "hills": false, "wetland": false, "confidence": "observed" },
    { "base": "forest_broadleaf", "rainfall": [76, 100], "drainage": [33, 100], "hills": false, "wetland": false, "confidence": "observed" }
  ],
  "variants": [
    { "base": "desert_sand", "bands": ["cold", "temperate", "tropical"], "biome": "DESERT_SAND", "confidence": "observed" },
    { "base": "desert_rock", "bands": ["cold", "temperate", "tropical"], "biome": "DESERT_ROCK", "confidence": "observed" },
    { "base": "badlands", "bands": ["cold", "temperate", "tropical"], "biome": "DESERT_BADLAND", "confidence": "observed" },
    { "base": "grassland", "bands": ["cold", "temperate"], "biome": "GRASSLAND_TEMPERATE", "confidence": "observed" },
    { "base": "grassland", "bands": ["tropical"], "biome": "GRASSLAND_TROPICAL", "confidence": "observed" },
    { "base": "savanna", "bands": ["cold", "temperate"], "biome": "SAVANNA_TEMPERATE", "confidence": "observed" },
    { "base": "savanna", "bands": ["tropical"], "biome": "SAVANNA_TROPICAL", "confidence": "observed" },
    { "base": "shrubland", "bands": ["cold", "temperate"], "biome": "SHRUBLAND_TEMPERATE", "confidence": "observed" },
    { "base": "shrubland", "bands": ["tropical"], "biome": "SHRUBLAND_TROPICAL", "confidence": "observed" },
    { "base": "marsh", "bands": ["cold", "temperate"], "saline": false, "biome": "MARSH_TEMPERATE_FRESHWATER", "confidence": "observed" },
    { "base": "marsh", "bands": ["cold", "temperate"], "saline": true, "biome": "MARSH_TEMPERATE_SALTWATER", "confidence": "observed" },
    { "base": "marsh", "bands": ["tropical"], "saline": false, "biome": "MARSH_TROPICAL_FRESHWATER", "confidence": "observed" },
    { "base": "marsh", "bands": ["tropical"], "saline": true, "biome": "MARSH_TROPICAL_SALTWATER", "confidence": "observed" },
    { "base": "swamp", "bands": ["cold", "temperate"], "saline": false, "biome": "SWAMP_TEMPERATE_FRESHWATER", "confidence": "observed" },
    { "base": "swamp", "bands": ["cold", "temperate"], "saline": true, "biome": "SWAMP_TEMPERATE_SALTWATER", "confidence": "observed" },
    { "base": "swamp", "bands": ["tropical"], "saline": false, "biome": "SWAMP_TROPICAL_FRESHWATER", "confidence": "observed" },
    { "base": "swamp", "bands": ["tropical"], "saline": true, "biome": "SWAMP_TROPICAL_SALTWATER", "confidence": "observed" },
    { "base": "forest_conifer", "bands": ["cold"], "biome": "FOREST_TAIGA", "confidence": "observed" },
    { "base": "forest_conifer", "bands": ["temperate"], "biome": "FOREST_TEMPERATE_CONIFER", "confidence": "observed" },
    { "base": "forest_conifer", "bands": ["tropical"], "biome": "FOREST_TROPICAL_CONIFER", "confidence": "unverified" },
    { "base": "forest_broadleaf", "bands": ["cold"], "biome": "FOREST_TAIGA", "confidence": "unverified" },
    { "base": "forest_broadleaf", "bands": ["temperate"], "biome": "FOREST_TEMPERATE_BROADLEAF", "confidence": "observed" },
    { "base": "forest_broadleaf", "bands": ["tropical"], "biome": "FOREST_TROPICAL_MOIST_BROADLEAF", "confidence": "unverified" }
  ],
  "mangrove": { "base": "swamp", "band": "tropical", "biome": "SWAMP_MANGROVE", "confidence": "observed" },
  "special": { "mountain": "MOUNTAIN", "tundra": "TUNDRA", "glacier": "GLACIER" },
  "ocean": [